{
  "$schema": "../schemas/pass-evidence-policy.v0.json",
  "schema_version": "pass-evidence-policy.v0",
  "updated": "2026-04-30",
  "description": "Tracked truth-steward evidence policy. These branches are Truth-state for proposer passes; the Python enforces this file instead of owning the identity graph.",
  "policies": {
    "identity_resolution": {
      "description": "Evidence boundaries for identity-resolution sweeps across any source page.",
      "source_url_always_allowed": true,
      "own_site_exact_paths": [
        "/",
        "/about/",
        "/about/entity-map/",
        "/about/credits/",
        "/animation/",
        "/animation/cartoons/",
        "/animation/cartoons/wizard-saga/",
        "/music/",
        "/music/discography/",
        "/music/live-performances/",
        "/music/live-performances/i-know-how-much-you-like-to-be-alone/",
        "/music/streaming-links/",
        "/music/uses-in-media/",
        "/music/uses-in-media/migration/",
        "/links/"
      ],
      "own_site_path_prefixes": [],
      "external_url_prefixes": [
        "https://github.com/chewgumlabs",
        "https://www.linkedin.com/in/shanecurrycartoons/",
        "https://www.imdb.com/name/nm10274522/",
        "https://www.youtube.com/@infinitehush",
        "https://youtu.be/Qpg4I8zn0DA",
        "https://www.youtube.com/embed/Qpg4I8zn0DA",
        "https://shanecurry.bandcamp.com/",
        "https://open.spotify.com/artist/7Bsj4BwNK4ZDLI5JUNSXcg",
        "https://music.apple.com/us/artist/shane-curry/1444977015",
        "https://www.shazam.com/artist/%2A/1444977015/releases",
        "https://store.steampowered.com/app/2704670/My_Valiant_Purpose/",
        "https://infinitehush.itch.io/chew-gum",
        "https://shellylynnx.itch.io/migration",
        "https://shellylynnx.com/",
        "https://youtu.be/W8lG1zSWIgc",
        "https://www.youtube.com/embed/W8lG1zSWIgc",
        "https://chewgumseries.tumblr.com/",
        "https://chewgumseries.gumroad.com/",
        "https://www.patreon.com/INFINITEHUSH"
      ],
      "seed_files": [
        "content/index.frag.html",
        "content/index.jsonld",
        "content/about/index.frag.html",
        "content/about/index.jsonld",
        "content/about/entity-map/index.frag.html",
        "content/about/entity-map/index.jsonld",
        "content/about/credits/index.frag.html",
        "content/about/credits/index.jsonld",
        "content/animation/index.frag.html",
        "content/animation/index.jsonld",
        "content/animation/cartoons/index.frag.html",
        "content/animation/cartoons/index.jsonld",
        "content/animation/cartoons/wizard-saga/index.frag.html",
        "content/animation/cartoons/wizard-saga/index.jsonld",
        "content/music/index.frag.html",
        "content/music/index.jsonld",
        "content/music/discography/index.frag.html",
        "content/music/discography/index.jsonld",
        "content/music/live-performances/index.frag.html",
        "content/music/live-performances/index.jsonld",
        "content/music/live-performances/i-know-how-much-you-like-to-be-alone/index.frag.html",
        "content/music/live-performances/i-know-how-much-you-like-to-be-alone/index.jsonld",
        "content/music/streaming-links/index.frag.html",
        "content/music/streaming-links/index.jsonld",
        "content/music/uses-in-media/index.frag.html",
        "content/music/uses-in-media/index.jsonld",
        "content/music/uses-in-media/migration/index.frag.html",
        "content/music/uses-in-media/migration/index.jsonld",
        "content/links/index.frag.html",
        "content/links/index.jsonld",
        "site/llms.txt"
      ],
      "notes": [
        "Keep old release surfaces here only when they help resolve Shane Curry / ChewGum Labs / ChewGum Animation / Infinite Hush.",
        "Do not add general lab artifact URLs here unless they are being used as identity anchors, not artifact proof."
      ]
    }
  }
}
